{
  "AssetId": "Loco.Pending.01",
  "AssetName": "Pending",
  "Category": "locomotive",
  "Creator": "unknown",
  "Source": "unknown",
  "SourceReference": "unknown",
  "AcquisitionDate": null,
  "License": "unknown",
  "CommercialUse": "unknown",
  "ModificationPermission": "unknown",
  "RedistributionRestrictions": "unknown",
  "AttributionRequirement": "unknown",
  "OriginalArchive": "unknown",
  "ModifiedAssetReference": "unknown",
  "VerificationStatus": "pending review",
  "VerificationEvidence": [],
  "Notes": "Template only; no asset acquired."
}
